{
  "format": "cfo.checkpoint-policy",
  "version": 1,
  "roots": ["work", ".claude", ".claude.json", ".codex", ".omnigent"],
  "rules": [
    {
      "id": "omnigent-login",
      "harness": "omnigent",
      "class": "secret",
      "action": "exclude",
      "root": "home",
      "patterns": [
        ".omnigent/auth_tokens.json",
        ".omnigent/.auth_tokens.json.*.tmp",
        ".omnigent/auth_tokens.lock"
      ],
      "why": "An Omnigent login file; computers authenticate with launch tokens, never on disk."
    },
    {
      "id": "claude-credentials",
      "harness": "claude-code",
      "class": "credential",
      "action": "credential",
      "root": "home",
      "patterns": [".claude/.credentials.json", ".claude/.credentials.json.*"],
      "why": "Claude Code's login. Its atomic writer stages <target>.tmp.<8 hex> or .tmp.<pid>.<12 hex> beside it."
    },
    {
      "id": "claude-device-keys",
      "harness": "claude-code",
      "class": "credential",
      "action": "credential",
      "root": "home",
      "patterns": [
        ".claude/.device-keys.json",
        ".claude/.device-keys.json.*",
        ".claude/.device-keys.lock"
      ],
      "why": "Claude Code's device-key store, which the binary can write; login material."
    },
    {
      "id": "codex-auth",
      "harness": "codex",
      "class": "credential",
      "action": "credential",
      "root": "home",
      "patterns": [".codex/auth.json", ".codex/auth.json.*"],
      "why": "Codex's login. Codex rewrites it in place; any sibling named after it is treated as a copy."
    },
    {
      "id": "codex-mcp-credentials",
      "harness": "codex",
      "class": "credential",
      "action": "credential",
      "root": "home",
      "patterns": [".codex/.credentials.json", ".codex/.credentials.json.*"],
      "why": "Codex's store for MCP sign-ins (SEC-07)."
    },
    {
      "id": "codex-home-auth",
      "harness": "codex-native",
      "class": "credential-link",
      "action": "exclude",
      "root": "home",
      "patterns": [".omnigent/codex-native/*/codex-home/auth.json"],
      "why": "A symbolic link (or a copied fallback) to ~/.codex/auth.json; the start relinks it."
    },
    {
      "id": "codex-home-mcp-credentials",
      "harness": "codex-native",
      "class": "credential-link",
      "action": "exclude",
      "root": "home",
      "patterns": [
        ".omnigent/codex-native/*/codex-home/.credentials.json",
        ".omnigent/codex-native/*/codex-home/.credentials.json.*"
      ],
      "why": "A hard link to ~/.codex/.credentials.json (or a copy); excluded by path whatever its type."
    },
    {
      "id": "codex-model-probe-cache",
      "harness": "codex-native",
      "class": "credential-link",
      "action": "exclude",
      "root": "home",
      "patterns": [".omnigent/cache/codex-model-probe/**"],
      "why": "A second set of the credential links; a regenerated cache."
    },
    {
      "id": "codex-policy-hook",
      "harness": "codex-native",
      "class": "secret",
      "action": "exclude",
      "root": "home",
      "patterns": [
        ".omnigent/codex-native/*/policy_hook.json",
        ".omnigent/codex-native/*/policy_hook.json.*"
      ],
      "why": "Bearer headers for the policy hook (mkstemp 'policy_hook.json.' then os.replace)."
    },
    {
      "id": "codex-bridge-json",
      "harness": "codex-native",
      "class": "secret",
      "action": "exclude",
      "root": "home",
      "patterns": [
        ".omnigent/codex-native/*/bridge.json",
        ".omnigent/codex-native/*/bridge.json.*"
      ],
      "why": "The serve-mcp bearer; recreated when missing."
    },
    {
      "id": "codex-provider-key",
      "harness": "codex-native",
      "class": "secret",
      "action": "exclude",
      "root": "home",
      "patterns": [
        ".omnigent/codex-native/*/provider_key",
        ".omnigent/codex-native/*/provider_key.*"
      ],
      "why": "Core change 20: an Omnigent key provider's API key, 0600, for the app-server's life (mkstemp 'provider_key.')."
    },
    {
      "id": "bridge-server-json",
      "harness": "both",
      "class": "secret",
      "action": "exclude",
      "root": "home",
      "patterns": [
        ".omnigent/codex-native/*/server.json",
        ".omnigent/codex-native/*/.server.json.*.tmp"
      ],
      "why": "Bearer, and a socket path that is dead after a restore."
    },
    {
      "id": "bridge-tool-relay",
      "harness": "both",
      "class": "secret",
      "action": "exclude",
      "root": "home",
      "patterns": [
        ".omnigent/codex-native/*/tool_relay.json",
        ".omnigent/codex-native/*/.tool_relay.json.*.tmp"
      ],
      "why": "Relay bearer; a stale copy advertises tools at a dead port."
    },
    {
      "id": "bridge-tool-relay-env",
      "harness": "both",
      "class": "secret",
      "action": "exclude",
      "root": "home",
      "patterns": [".omnigent/codex-native/*/tool_relay.env"],
      "why": "Written in place with OMNIGENT_RELAY_TOKEN: no temporary sibling."
    },
    {
      "id": "bridge-routers",
      "harness": "both",
      "class": "secret",
      "action": "exclude",
      "root": "home",
      "patterns": [
        ".omnigent/codex-native/*/turn_router.json",
        ".omnigent/codex-native/*/turn_router.json.*.tmp",
        ".omnigent/codex-native/*/subagent_router.json",
        ".omnigent/codex-native/*/subagent_router.json.*.tmp"
      ],
      "why": "Loopback route-turn bearers (Smart Routing sessions)."
    },
    {
      "id": "codex-bridge-locks",
      "harness": "codex-native",
      "class": "runtime",
      "action": "exclude",
      "root": "home",
      "patterns": [
        ".omnigent/codex-native/.locks",
        ".omnigent/codex-native/.locks/**",
        ".omnigent/codex-native/*/state.lock",
        ".omnigent/codex-native/*/unmirrored_settings.lock"
      ],
      "why": "Lock files; no value after a restore."
    },
    {
      "id": "codex-bridge-runtime",
      "harness": "codex-native",
      "class": "runtime",
      "action": "exclude",
      "root": "home",
      "patterns": [
        ".omnigent/codex-native/*/owner.pid",
        ".omnigent/codex-native/*/state.json",
        ".omnigent/codex-native/*/state.json.*",
        ".omnigent/codex-native/*/startup_error.json",
        ".omnigent/codex-native/*/startup_error.json.*",
        ".omnigent/codex-native/*/startup_timeout.json",
        ".omnigent/codex-native/*/startup_timeout.json.*",
        ".omnigent/codex-native/*/egress_certificate_failure.json",
        ".omnigent/codex-native/*/egress_certificate_failure.json.*",
        ".omnigent/codex-native/*/mcp_startup.json",
        ".omnigent/codex-native/*/mcp_startup.json.*",
        ".omnigent/codex-native/*/unmirrored_settings.json",
        ".omnigent/codex-native/*/unmirrored_settings.json.*",
        ".omnigent/codex-native/*/app-server.sock",
        ".omnigent/codex-native/*/turn_routing.log",
        ".omnigent/codex-native/*/dead_letter.jsonl.tmp",
        ".omnigent/codex-native/*/dead_letter.jsonl.1.tmp",
        ".omnigent/codex-native/*/side_chat_requests/*.tmp"
      ],
      "why": "Per-process state; a restored copy points turns at a dead app-server."
    },
    {
      "id": "codex-process-registry",
      "harness": "codex-native",
      "class": "runtime",
      "action": "exclude",
      "root": "home",
      "patterns": [
        ".omnigent/codex-native/process-registry.json",
        ".omnigent/codex-native/process-registry.json.tmp",
        ".omnigent/codex-native/process-registry.json.lock",
        ".omnigent/codex-native/process-owners/**"
      ],
      "why": "PIDs and boot IDs; dropped on reconcile after a restore."
    },
    {
      "id": "codex-home-skills",
      "harness": "codex-native",
      "class": "runtime",
      "action": "exclude",
      "root": "home",
      "patterns": [".omnigent/codex-native/*/codex-home/skills/**"],
      "why": "Links into a temporary bundle directory; re-linked at launch."
    },
    {
      "id": "codex-home-temporaries",
      "harness": "codex-native",
      "class": "runtime",
      "action": "exclude",
      "root": "home",
      "patterns": [
        ".omnigent/codex-native/*/codex-home/config.toml.*",
        ".omnigent/codex-native/*/codex-home/.config.toml.*",
        ".omnigent/codex-native/*/codex-home/..omnigent-config-profile.toml.*",
        ".omnigent/codex-native/*/codex-home/..omnigent-developer-instructions-state.toml.*",
        ".omnigent/codex-native/*/codex-home/hooks.json.*",
        ".omnigent/codex-native/*/codex-home/sessions/**/.rollout-*.jsonl.*.tmp",
        ".omnigent/codex-native/*/codex-home/sessions/**/rollout-*.jsonl.tmp",
        ".omnigent/codex-native/*/codex-home/log/**",
        ".omnigent/codex-native/*/codex-home/.tmp/**",
        ".omnigent/codex-native/*/codex-home/cache/**"
      ],
      "why": "Temporary siblings of saved files, and the same log, .tmp and cache exclusions as ~/.codex."
    },
    {
      "id": "omnigent-cache",
      "harness": "omnigent",
      "class": "cache",
      "action": "exclude",
      "root": "home",
      "patterns": [".omnigent/cache/**"],
      "why": "Model catalogue and other caches; regenerated."
    },
    {
      "id": "codex-home-config",
      "harness": "codex-native",
      "class": "continuation",
      "action": "save",
      "root": "home",
      "patterns": [
        ".omnigent/codex-native/*/codex-home/config.toml",
        ".omnigent/codex-native/*/codex-home/.omnigent-config-profile.toml"
      ],
      "why": "The session's private settings. Core change 20 keeps any provider key out of them (S6's 'decide', settled)."
    },
    {
      "id": "codex-home-continuation",
      "harness": "codex-native",
      "class": "continuation",
      "action": "save",
      "root": "home",
      "patterns": [